mysql> create table bank(
    -> bank_id int primary key auto_increment,
    -> bankname varchar(15) not null unique,
    -> branchcode varchar(5) not null unique,
    -> ifsc varchar(11) unique check(length(ifsc)=11),
    -> location varchar(50) default 'not provided',
    -> founded int check (founded >1900)
    -> );

mysql> desc bank;
+------------+-------------+------+-----+--------------+----------------+
| Field      | Type        | Null | Key | Default      | Extra          |
+------------+-------------+------+-----+--------------+----------------+
| bank_id    | int         | NO   | PRI | NULL         | auto_increment |
| bankname   | varchar(15) | NO   | UNI | NULL         |                |
| branchcode | varchar(5)  | NO   | UNI | NULL         |                |
| ifsc       | varchar(11) | YES  | UNI | NULL         |                |
| location   | varchar(50) | YES  |     | not provided |                |
| founded    | int         | YES  |     | NULL         |                |
| cityid     | int         | YES  | MUL | NULL         |                |
+------------+-------------+------+-----+--------------+----------------+
7 rows in set (0.01 sec)



mysql> create table City(
    -> CityID int primary key auto_increment,
    -> CityName varchar(50) not null,
    -> State varchar(50) not null
    -> );



Step 4: Add a Foreign Key
Suppose you also have a table City that contains CityID and CityName. Add a foreign key to link Bank to City.

Add Column: CityID (as a Foreign Key).

sql
ALTER TABLE Bank 
ADD CityID INT,
ADD CONSTRAINT fk_city 
FOREIGN KEY (CityID) REFERENCES City(CityID);



mysql> insert into City values(101,'Mumbai','MH');
Query OK, 1 row affected (0.01 sec)
mysql> insert into City(CityName,State) values('Pune','MH');
Query OK, 1 row affected (0.00 sec)
mysql> insert into City(CityName,State) values('Banglore','Karnatak'),
    -> ('Chennai','TN'),
    -> ('Ahemdabad','Gujarat');
Query OK, 3 rows affected (0.01 sec)
Records: 3  Duplicates: 0  Warnings: 0


mysql> select * from City;
+--------+-----------+----------+
| CityID | CityName  | State    |
+--------+-----------+----------+
|    101 | Mumbai    | MH       |
|    102 | Pune      | MH       |
|    103 | Banglore  | Karnatak |
|    104 | Chennai   | TN       |
|    105 | Ahemdabad | Gujarat  |
+--------+-----------+----------+
5 rows in set (0.00 sec)


mysql> Alter table bank
    -> add cityid int,
    -> add constraint fk_city
    -> foreign key (cityid) references City(CityID);
Query OK, 0 rows affected (0.15 sec)
Records: 0  Duplicates: 0  Warnings: 0


mysql> insert into bank(bank_id,bankname,branchcode,ifsc,location,founded,cityid)
    -> values (1,'SBI Bank','BR001','SBIN0001234','Mumbai',1955,101);
Query OK, 1 row affected (0.00 sec)


insert into bank(bankname,branchcode,ifsc,location,founded,cityid)
    -> values ('HDFC Bank','BR002','HDFC0005678','Pune',1994,102),
    -> ('ICICI Bank','BR003','ICIC0009876','Banglore',2000,103),
    -> ('AXIS Bank','BR004','AXIS0005432','Chennai',1998,104),
    -> ('Bank of Baroda','BR005','BARB000689','Not Provided',1930,105);


mysql> select * from bank;
+---------+----------------+------------+-------------+--------------+---------+--------+
| bank_id | bankname       | branchcode | ifsc        | location     | founded | cityid |
+---------+----------------+------------+-------------+--------------+---------+--------+
|       1 | SBI Bank       | BR001      | SBIN0001234 | Mumbai       |    1955 |    101 |
|       2 | HDFC Bank      | BR002      | HDFC0005678 | Pune         |    1994 |    102 |
|       3 | ICICI Bank     | BR003      | ICIC0009876 | Banglore     |    2000 |    103 |
|       4 | AXIS Bank      | BR004      | AXIS0005432 | Chennai      |    1998 |    104 |
|       5 | Bank of Baroda | BR005      | BARB0006789 | Not Provided |    1930 |    105 |
+---------+----------------+------------+-------------+--------------+---------+--------+
5 rows in set (0.00 sec)




				1. WHERE Clause

1. Retrieve all banks located in Maharashtra.
  mysql> select bankname from bank where location='MH';
  Empty set (0.05 sec)  


2. Select banks established after the year 1990.
	mysql> select * from bank where founded > 1990;
+---------+------------+------------+-------------+----------+---------+--------+
| bank_id | bankname   | branchcode | ifsc        | location | founded | cityid |
+---------+------------+------------+-------------+----------+---------+--------+
|       2 | HDFC Bank  | BR002      | HDFC0005678 | Pune     |    1994 |    102 |
|       3 | ICICI Bank | BR003      | ICIC0009876 | Banglore |    2000 |    103 |
|       4 | AXIS Bank  | BR004      | AXIS0005432 | Chennai  |    1998 |    104 |
+---------+------------+------------+-------------+----------+---------+--------+
3 rows in set (0.00 sec)

3. Fetch details of banks whose EstablishedYear is between 1950 and 2000.

	mysql> select * from bank where founded between 1950 and 2000;
+---------+------------+------------+-------------+----------+---------+--------+
| bank_id | bankname   | branchcode | ifsc        | location | founded | cityid |
+---------+------------+------------+-------------+----------+---------+--------+
|       1 | SBI Bank   | BR001      | SBIN0001234 | Mumbai   |    1955 |    101 |
|       2 | HDFC Bank  | BR002      | HDFC0005678 | Pune     |    1994 |    102 |
|       3 | ICICI Bank | BR003      | ICIC0009876 | Banglore |    2000 |    103 |
|       4 | AXIS Bank  | BR004      | AXIS0005432 | Chennai  |    1998 |    104 |
+---------+------------+------------+-------------+----------+---------+--------+
4 rows in set (0.04 sec)


4. Retrieve all banks where the Location is not 'Mumbai'.

mysql> select * from bank where location != 'Mumbai';
+---------+----------------+------------+-------------+--------------+---------+--------+
| bank_id | bankname       | branchcode | ifsc        | location     | founded | cityid |
+---------+----------------+------------+-------------+--------------+---------+--------+
|       2 | HDFC Bank      | BR002      | HDFC0005678 | Pune         |    1994 |    102 |
|       3 | ICICI Bank     | BR003      | ICIC0009876 | Banglore     |    2000 |    103 |
|       4 | AXIS Bank      | BR004      | AXIS0005432 | New Delhi    |    1998 |    104 |
|       5 | Bank of Baroda | BR005      | BARB0006789 | Not Provided |    1931 |    105 |
+---------+----------------+------------+-------------+--------------+---------+--------+
4 rows in set (0.01 sec)


5. Select banks with BranchCode starting with 'BR00'.

mysql> select * from bank where branchcode like 'BR00%';
+---------+----------------+------------+-------------+--------------+---------+--------+
| bank_id | bankname       | branchcode | ifsc        | location     | founded | cityid |
+---------+----------------+------------+-------------+--------------+---------+--------+
|       1 | SBI Bank       | BR001      | SBIN0001234 | Mumbai       |    1955 |    101 |
|       2 | HDFC Bank      | BR002      | HDFC0005678 | Pune         |    1994 |    102 |
|       3 | ICICI Bank     | BR003      | ICIC0009876 | Banglore     |    2000 |    103 |
|       4 | AXIS Bank      | BR004      | AXIS0005432 | New Delhi    |    1998 |    104 |
|       5 | Bank of Baroda | BR005      | BARB0006789 | Not Provided |    1931 |    105 |
+---------+----------------+------------+-------------+--------------+---------+--------+
5 rows in set (0.00 sec)



6. Fetch details of banks with EstablishedYear less than 2000 and located in 'Pune'.

mysql> select * from bank where founded < 2000 and location = 'Pune';
+---------+-----------+------------+-------------+----------+---------+--------+
| bank_id | bankname  | branchcode | ifsc        | location | founded | cityid |
+---------+-----------+------------+-------------+----------+---------+--------+
|       2 | HDFC Bank | BR002      | HDFC0005678 | Pune     |    1994 |    102 |
+---------+-----------+------------+-------------+----------+---------+--------+
1 row in set (0.00 sec)



7. Find banks where the IFSC_Code contains '000'.

mysql> select * from bank where ifsc like '%000%';
+---------+----------------+------------+-------------+--------------+---------+--------+
| bank_id | bankname       | branchcode | ifsc        | location     | founded | cityid |
+---------+----------------+------------+-------------+--------------+---------+--------+
|       1 | SBI Bank       | BR001      | SBIN0001234 | Mumbai       |    1955 |    101 |
|       2 | HDFC Bank      | BR002      | HDFC0005678 | Pune         |    1994 |    102 |
|       3 | ICICI Bank     | BR003      | ICIC0009876 | Banglore     |    2000 |    103 |
|       4 | AXIS Bank      | BR004      | AXIS0005432 | New Delhi    |    1998 |    104 |
|       5 | Bank of Baroda | BR005      | BARB0006789 | Not Provided |    1931 |    105 |
+---------+----------------+------------+-------------+--------------+---------+--------+
5 rows in set (0.00 sec)



8. Retrieve banks with BankName containing the word 'Bank'.

mysql> select bankname from bank where bankname like '%Bank%';
+----------------+
| bankname       |
+----------------+
| AXIS Bank      |
| Bank of Baroda |
| HDFC Bank      |
| ICICI Bank     |
| SBI Bank       |
+----------------+
5 rows in set (0.00 sec)




				2.  UPDATE Statement

1. Update the Location to 'New Delhi' for the bank with BankName = 'Axis Bank'.

mysql> update bank set location = 'New Delhi' where bankname = 'Axis Bank';
Query OK, 1 row affected (0.01 sec)
Rows matched: 1  Changed: 1  Warnings: 0

mysql> select * from bank;
+---------+----------------+------------+-------------+--------------+---------+--------+
| bank_id | bankname       | branchcode | ifsc        | location     | founded | cityid |
+---------+----------------+------------+-------------+--------------+---------+--------+
|       1 | SBI Bank       | BR001      | SBIN0001234 | Mumbai       |    1955 |    101 |
|       2 | HDFC Bank      | BR002      | HDFC0005678 | Pune         |    1994 |    102 |
|       3 | ICICI Bank     | BR003      | ICIC0009876 | Banglore     |    2000 |    103 |
|       4 | AXIS Bank      | BR004      | AXIS0005432 | New Delhi    |    1998 |    104 |
|       5 | Bank of Baroda | BR005      | BARB0006789 | Not Provided |    1930 |    105 |
+---------+----------------+------------+-------------+--------------+---------+--------+
5 rows in set (0.00 sec)




2. Increase the EstablishedYear by 1 for all banks established before 1950.

mysql> update bank set location = 'New Delhi' where bankname = 'Axis Bank';
Query OK, 1 row affected (0.01 sec)
Rows matched: 1  Changed: 1  Warnings: 0

mysql> select * from bank;
+---------+----------------+------------+-------------+--------------+---------+--------+
| bank_id | bankname       | branchcode | ifsc        | location     | founded | cityid |
+---------+----------------+------------+-------------+--------------+---------+--------+
|       1 | SBI Bank       | BR001      | SBIN0001234 | Mumbai       |    1955 |    101 |
|       2 | HDFC Bank      | BR002      | HDFC0005678 | Pune         |    1994 |    102 |
|       3 | ICICI Bank     | BR003      | ICIC0009876 | Banglore     |    2000 |    103 |
|       4 | AXIS Bank      | BR004      | AXIS0005432 | New Delhi    |    1998 |    104 |
|       5 | Bank of Baroda | BR005      | BARB0006789 | Not Provided |    1930 |    105 |
+---------+----------------+------------+-------------+--------------+---------+--------+
5 rows in set (0.00 sec)



3. Set the Location to 'Not Provided' for all banks where it is currently NULL.

mysql> update bank set founded = founded+1 where founded < 1950;
Query OK, 1 row affected (0.04 sec)
Rows matched: 1  Changed: 1  Warnings: 0

mysql> select * from bank;
+---------+----------------+------------+-------------+--------------+---------+--------+
| bank_id | bankname       | branchcode | ifsc        | location     | founded | cityid |
+---------+----------------+------------+-------------+--------------+---------+--------+
|       1 | SBI Bank       | BR001      | SBIN0001234 | Mumbai       |    1955 |    101 |
|       2 | HDFC Bank      | BR002      | HDFC0005678 | Pune         |    1994 |    102 |
|       3 | ICICI Bank     | BR003      | ICIC0009876 | Banglore     |    2000 |    103 |
|       4 | AXIS Bank      | BR004      | AXIS0005432 | New Delhi    |    1998 |    104 |
|       5 | Bank of Baroda | BR005      | BARB0006789 | Not Provided |    1931 |    105 |
+---------+----------------+------------+-------------+--------------+---------+--------+
5 rows in set (0.00 sec)


4. Update the Location to 'Bangalore' for banks established in 1998.

mysql> update bank set location = 'Banglore' where founded =1998;
Query OK, 1 row affected (0.01 sec)
Rows matched: 1  Changed: 1  Warnings: 0

mysql> select * from bank where founded = 1998;
+---------+----------------+------------+-------------+--------------+---------+--------+
| bank_id | bankname       | branchcode | ifsc        | location     | founded | cityid |
+---------+----------------+------------+-------------+--------------+---------+--------+
|       4 | AXIS Bank      | BR004      | AXIS0005432 | Banglore     |    1998 |    104 |
+---------+----------------+------------+-------------+--------------+---------+--------+
5 rows in set (0.00 sec)

5. Change the BranchCode to 'BR999' for the bank with BankName = 'SBI Bank'.

mysql> update bank set branchcode = 'BR999' where bankname = 'SBI Bank';
Query OK, 1 row affected (0.01 sec)
Rows matched: 1  Changed: 1  Warnings: 0

mysql> select * from bank where branchcode='BR999';
+---------+----------------+------------+-------------+--------------+---------+--------+
| bank_id | bankname       | branchcode | ifsc        | location     | founded | cityid |
+---------+----------------+------------+-------------+--------------+---------+--------+
|       1 | SBI Bank       | BR999      | SBIN0001234 | Mumbai       |    1955 |    101 |
+---------+----------------+------------+-------------+--------------+---------+--------+
1 rows in set (0.00 sec)

6. Update the EstablishedYear to 2005 for banks with BankID greater than 3.

mysql> update bank set founded = 2005 where bank_id >3;
Query OK, 2 rows affected (0.00 sec)
Rows matched: 2  Changed: 2  Warnings: 0

mysql> select * from bank;
+---------+----------------+------------+-------------+--------------+---------+--------+
| bank_id | bankname       | branchcode | ifsc        | location     | founded | cityid |
+---------+----------------+------------+-------------+--------------+---------+--------+
|       4 | AXIS Bank      | BR004      | AXIS0005432 | Banglore     |    2005 |    104 |
|       5 | Bank of Baroda | BR005      | BARB0006789 | Not Provided |    2005 |    105 |
+---------+----------------+------------+-------------+--------------+---------+--------+
2 rows in set (0.00 sec)

7. Set all Location fields to uppercase.

mysql> update bank set location = upper(location) ;
Query OK, 5 rows affected (0.01 sec)
Rows matched: 5  Changed: 5  Warnings: 0


mysql> select * from bank;
+---------+----------------+------------+-------------+--------------+---------+--------+
| bank_id | bankname       | branchcode | ifsc        | location     | founded | cityid |
+---------+----------------+------------+-------------+--------------+---------+--------+
|       1 | SBI Bank       | BR999      | SBIN0001234 | MUMBAI       |    1955 |    101 |
|       2 | HDFC Bank      | BR002      | HDFC0005678 | PUNE         |    1994 |    102 |
|       3 | ICICI Bank     | BR003      | ICIC0009876 | BANGLORE     |    2000 |    103 |
|       4 | AXIS Bank      | BR004      | AXIS0005432 | BANGLORE     |    2005 |    104 |
|       5 | Bank of Baroda | BR005      | BARB0006789 | NOT PROVIDED |    2005 |    105 |
+---------+----------------+------------+-------------+--------------+---------+--------+
5 rows in set (0.00 sec)



8. Add 'Updated-' as a prefix to all BankName values.

UPDATE Bank SET BankName = CONCAT('Updated-', BankName);

mysql> select * from bank;
+---------+------------------------+------------+-------------+--------------+---------+--------+
| bank_id | bankname               | branchcode | ifsc        | location     | founded | cityid |
+---------+------------------------+------------+-------------+--------------+---------+--------+
|       1 | Updated SBI Bank       | BR999      | SBIN0001234 | MUMBAI       |    1955 |    101 |
|       2 | Updated HDFC Bank      | BR002      | HDFC0005678 | PUNE         |    1994 |    102 |
|       3 | Updated ICICI Bank     | BR003      | ICIC0009876 | BANGLORE     |    2000 |    103 |
|       4 | Updated AXIS Bank      | BR004      | AXIS0005432 | BANGLORE     |    2005 |    104 |
|       5 | Updated Bank of Baroda | BR005      | BARB0006789 | NOT PROVIDED |    2005 |    105 |
+---------+------------------------+------------+-------------+--------------+---------+--------+
5 rows in set (0.00 sec)

9. Remove updated from bankname.
   Use trim function 

mysql> update bank set bankname = Right(bankname,8);
Query OK, 5 rows affected (0.04 sec)
Rows matched: 5  Changed: 5  Warnings: 0







			3. DELETE Statement:
1. Delete the bank record where the BankID is 5.

      Delete from bank where bank_id =5;


2. Remove all banks established before 1940.
     
      Delete from bank where founded <1940;

3. Delete all banks with a NULL value in the Location column.
        
      Delete from bank where location is null;


			4. ALIAS:



1. Display BankName as Bank_Name and Location as City.

mysql> Select bankname as Bank_Name, location as City from bank;
+----------------+--------------+
| Bank_Name      | City         |
+----------------+--------------+
| SBI Bank       | Mumbai       |
| HDFC Bank      | Pune         |
| ICICI Bank     | Banglore     |
| AXIS Bank      | New Delhi    |
| Bank of Baroda | Not Provided |
+----------------+--------------+
5 rows in set (0.00 sec)



2. Fetch BankID and alias it as ID and display EstablishedYear as Year.



mysql> select bank_id as ID,founded as Year from bank;
+----+------+
| ID | Year |
+----+------+
|  1 | 1955 |
|  2 | 1994 |
|  3 | 2000 |
|  4 | 1998 |
|  5 | 1931 |
+----+------+
5 rows in set (0.00 sec)



3. Create a query to display the IFSC_Code column as Bank_IFSC.

mysql> select ifsc as Bank_IFSC from bank;
+-------------+
| Bank_IFSC   |
+-------------+
| AXIS0005432 |
| BARB0006789 |
| HDFC0005678 |
| ICIC0009876 |
| SBIN0001234 |
+-------------+
5 rows in set (0.00 sec)




                        5. String Functions

1. Retrieve the UPPERCASE version of all BankName.

mysql> select upper(bankname) as UPPERCASE from bank;
+----------------+
| UPPERCASE      |
+----------------+
| AXIS BANK      |
| BANK OF BARODA |
| HDFC BANK      |
| ICICI BANK     |
| SBI BANK       |
+----------------+
5 rows in set (0.00 sec)


2. Display the first 3 characters of each BranchCode.

mysql> select substring(branchcode,1,3) from bank;
+---------------------------+
| substring(branchcode,1,3) |
+---------------------------+
| BR0                       |
| BR0                       |
| BR0                       |
| BR0                       |
| BR0                       |
+---------------------------+
5 rows in set (0.04 sec)



3. Find the length of each BankName.

mysql> select left(branchcode,3) from bank;
+--------------------+
| left(branchcode,3) |
+--------------------+
| BR0                |
| BR0                |
| BR0                |
| BR0                |
| BR0                |
+--------------------+
5 rows in set (0.04 sec)

mysql> select bankname, length(bankname) from bank;
+----------------+------------------+
| bankname       | length(bankname) |
+----------------+------------------+
| AXIS Bank      |                9 |
| Bank of Baroda |               14 |
| HDFC Bank      |                9 |
| ICICI Bank     |               10 |
| SBI Bank       |                8 |
+----------------+------------------+
5 rows in set (0.00 sec)



4. Use UPPER() to display all BankName values in uppercase.

mysql> select upper(bankname) from bank;
+-----------------+
| upper(bankname) |
+-----------------+
| AXIS BANK       |
| BANK OF BARODA  |
| HDFC BANK       |
| ICICI BANK      |
| SBI BANK        |
+-----------------+
5 rows in set (0.00 sec)

5. Retrieve BankName in lowercase using LOWER().

mysql> select lower(bankname) from bank;
+-----------------+
| lower(bankname) |
+-----------------+
| axis bank       |
| bank of baroda  |
| hdfc bank       |
| icici bank      |
| sbi bank        |
+-----------------+
5 rows in set (0.00 sec)

6. Find the position of 'Bank' in each BankName using LOCATE().

mysql> select locate('Bank', bankname), bankname from bank;
+--------------------------+----------------+
| locate('Bank', bankname) | bankname       |
+--------------------------+----------------+
|                        6 | AXIS Bank      |
|                        1 | Bank of Baroda |
|                        6 | HDFC Bank      |
|                        7 | ICICI Bank     |
|                        5 | SBI Bank       |
+--------------------------+----------------+
5 rows in set (0.00 sec)


7. Replace 'Bank' with 'Branch' in all BankName values using REPLACE().

UPDATE Bank 
SET BankName = REPLACE(BankName, 'Bank', 'Branch');


8. Use SUBSTRING() to extract the first 5 characters of each IFSC_Code.

mysql> select substring(ifsc,1,5) from bank;
+---------------------+
| substring(ifsc,1,5) |
+---------------------+
| AXIS0               |
| BARB0               |
| HDFC0               |
| ICIC0               |
| SBIN0               |
+---------------------+
5 rows in set (0.00 sec)


9. Trim white spaces from Location using TRIM().

mysql> select trim(location) from bank;
+----------------+
| trim(location) |
+----------------+
| MUMBAI         |
| PUNE           |
| BANGLORE       |
| BANGLORE       |
| NOT PROVIDED   |
+----------------+
5 rows in set (0.00 sec)

10. Concatenate BankName and Location using CONCAT() with a hyphen (-) in between.

mysql> select concat(bankname,'-',location) from bank;
+-------------------------------+
| concat(bankname,'-',location) |
+-------------------------------+
| SBI Bank-MUMBAI               |
| HDFC Bank-PUNE                |
| ICICI Bank-BANGLORE           |
| AXIS Bank-BANGLORE            |
| Bank of Baroda-NOT PROVIDED   |
+-------------------------------+
5 rows in set (0.00 sec)

mysql> select concat_ws('-',bankname,location) from bank;
+----------------------------------+
| concat_ws('-',bankname,location) |
+----------------------------------+
| SBI Bank-MUMBAI                  |
| HDFC Bank-PUNE                   |
| ICICI Bank-BANGLORE              |
| AXIS Bank-BANGLORE               |
| Bank of Baroda-NOT PROVIDED      |
+----------------------------------+
5 rows in set (0.04 sec)




11. Pad BranchCode with zeros to make it 8 characters long using LPAD().

12. Reverse the IFSC_Code for all banks using REVERSE().

mysql> select reverse(ifsc) from bank;
+---------------+
| reverse(ifsc) |
+---------------+
| 2345000SIXA   |
| 9876000BRAB   |
| 8765000CFDH   |
| 6789000CICI   |
| 4321000NIBS   |
+---------------+
5 rows in set (0.04 sec)



13. Display BankName with only the first letter capitalized 
    using CONCAT(UCASE(LEFT(BankName, 1)), LCASE(SUBSTRING(BankName, 2))).






                    6. DISTINCT Keyword



1. Display all unique Locations from the Bank table.

mysql> select distinct location from bank;
+--------------+
| location     |
+--------------+
| Mumbai       |
| Pune         |
| Banglore     |
| New Delhi    |
| Not Provided |
+--------------+
5 rows in set (0.04 sec)



2. Fetch unique years from the EstablishedYear column.

mysql> select distinct founded from bank;
+---------+
| founded |
+---------+
|    1955 |
|    1994 |
|    2000 |
|    1998 |
|    1931 |
+---------+
5 rows in set (0.00 sec)


3. Show all distinct CityID values linked to the banks.

mysql> select distinct CityID from bank;
+--------+
| CityID |
+--------+
|    101 |
|    102 |
|    103 |
|    104 |
|    105 |
+--------+
5 rows in set (0.04 sec)



                   7. LIKE and NOT LIKE Keywords


1. Retrieve banks where the BankName starts with 'S'.

mysql> select bankname from bank where bankname like 'S%';
+----------+
| bankname |
+----------+
| SBI Bank |
+----------+
1 row in set (0.00 sec)


2. Fetch banks where the IFSC_Code ends with '789'.

mysql> select * from bank where ifsc like '%789%';
+---------+----------------+------------+-------------+--------------+---------+--------+
| bank_id | bankname       | branchcode | ifsc        | location     | founded | cityid |
+---------+----------------+------------+-------------+--------------+---------+--------+
|       5 | Bank of Baroda | BR005      | BARB0006789 | Not Provided |    1931 |    105 |
+---------+----------------+------------+-------------+--------------+---------+--------+
1 row in set (0.00 sec)


3. Display banks whose Location does not contain the word 'Mumbai'.

mysql> select * from bank where location not like '%Mumbai%';
+---------+----------------+------------+-------------+--------------+---------+--------+
| bank_id | bankname       | branchcode | ifsc        | location     | founded | cityid |
+---------+----------------+------------+-------------+--------------+---------+--------+
|       2 | HDFC Bank      | BR002      | HDFC0005678 | Pune         |    1994 |    102 |
|       3 | ICICI Bank     | BR003      | ICIC0009876 | Banglore     |    2000 |    103 |
|       4 | AXIS Bank      | BR004      | AXIS0005432 | New Delhi    |    1998 |    104 |
|       5 | Bank of Baroda | BR005      | BARB0006789 | Not Provided |    1931 |    105 |
+---------+----------------+------------+-------------+--------------+---------+--------+
4 rows in set (0.00 sec)


                            8. LIMIT


1. Fetch the first 3 records from the Bank table.

mysql> select * from bank limit 3;
+---------+------------+------------+-------------+----------+---------+--------+
| bank_id | bankname   | branchcode | ifsc        | location | founded | cityid |
+---------+------------+------------+-------------+----------+---------+--------+
|       1 | SBI Bank   | BR001      | SBIN0001234 | Mumbai   |    1955 |    101 |
|       2 | HDFC Bank  | BR002      | HDFC0005678 | Pune     |    1994 |    102 |
|       3 | ICICI Bank | BR003      | ICIC0009876 | Banglore |    2000 |    103 |
+---------+------------+------------+-------------+----------+---------+--------+
3 rows in set (0.04 sec)


2. Retrieve 2 records starting from the 2nd row (offset).

mysql> select * from bank limit 2 offset 1;
+---------+------------+------------+-------------+----------+---------+--------+
| bank_id | bankname   | branchcode | ifsc        | location | founded | cityid |
+---------+------------+------------+-------------+----------+---------+--------+
|       2 | HDFC Bank  | BR002      | HDFC0005678 | Pune     |    1994 |    102 |
|       3 | ICICI Bank | BR003      | ICIC0009876 | Banglore |    2000 |    103 |
+---------+------------+------------+-------------+----------+---------+--------+
2 rows in set (0.00 sec)


3. Display only the top bank (single record) based on BankID.

mysql> select * from bank order by bank_id limit 1;
+---------+----------+------------+-------------+----------+---------+--------+
| bank_id | bankname | branchcode | ifsc        | location | founded | cityid |
+---------+----------+------------+-------------+----------+---------+--------+
|       1 | SBI Bank | BR001      | SBIN0001234 | Mumbai   |    1955 |    101 |
+---------+----------+------------+-------------+----------+---------+--------+
1 row in set (0.00 sec)


                    9. Aggregate Functions

1. Count the total number of banks in the Bank table.

mysql> select count(bank_id) from bank;
+----------------+
| count(bank_id) |
+----------------+
|              5 |
+----------------+
1 row in set (0.04 sec)


2. Find the earliest year a bank was established.

mysql> select min(founded) from bank;
+--------------+
| min(founded) |
+--------------+
|         1931 |
+--------------+
1 row in set (0.04 sec)


3. mysql> select  count(distinct location) from bank ;
+--------------------------+
| count(distinct location) |
+--------------------------+
|                        5 |
+--------------------------+
1 row in set (0.04 sec)


4. Count the total number of banks in the Bank table.

mysql> select count(*) from bank;
+----------+
| count(*) |
+----------+
|        5 |
+----------+
1 row in set (0.00 sec)


5. Find the earliest and latest EstablishedYear using MIN() and MAX().

mysql> select max(founded) from bank;
+--------------+
| max(founded) |
+--------------+
|         2005 |
+--------------+
1 row in set (0.00 sec)

mysql> select MIN(founded) from bank;
+--------------+
| MIN(founded) |
+--------------+
|         1955 |
+--------------+
1 row in set (0.00 sec)

6. Calculate the average EstablishedYear for all banks.


mysql> select avg(founded) from bank;
+--------------+
| avg(founded) |
+--------------+
|    1991.8000 |
+--------------+
1 row in set (0.04 sec)



7. Find the sum of all CityID values linked to banks.

mysql> select sum(cityID) from bank;
+-------------+
| sum(cityID) |
+-------------+
|         515 |
+-------------+
1 row in set (0.00 sec)



8. Count the total number of unique Locations.


mysql> select distinct count(location) from bank;
+-----------------+
| count(location) |
+-----------------+
|               5 |
+-----------------+
1 row in set (0.04 sec)














                                        10.  GROUP BY Clause

1. Group banks by Location and count the number of banks in each location.

mysql> select location, count(*) from bank group by location;
+--------------+----------+
| location     | count(*) |
+--------------+----------+
| MUMBAI       |        1 |
| PUNE         |        1 |
| BANGLORE     |        2 |
| NOT PROVIDED |        1 |
+--------------+----------+
4 rows in set (0.00 sec)



2. Group banks by CityID and calculate the average EstablishedYear for each group.

mysql> select cityid, avg(founded) from bank group by cityid;
+--------+--------------+
| cityid | avg(founded) |
+--------+--------------+
|    101 |    1955.0000 |
|    102 |    1994.0000 |
|    103 |    2000.0000 |
|    104 |    2005.0000 |
|    105 |    2005.0000 |
+--------+--------------+
5 rows in set (0.00 sec)



3. Display the total number of banks for each EstablishedYear.

mysql> select founded, count(*) from bank group by founded;
+---------+----------+
| founded | count(*) |
+---------+----------+
|    1955 |        1 |
|    1994 |        1 |
|    2000 |        1 |
|    2005 |        2 |
+---------+----------+
4 rows in set (0.00 sec)



4. Retrieve the maximum EstablishedYear for each CityID.

mysql> select  max(founded) from bank group by cityid;
+--------------+
| max(founded) |
+--------------+
|         1955 |
|         1994 |
|         2000 |
|         2005 |
|         2005 |
+--------------+
5 rows in set (0.00 sec)




5. Count the number of distinct BranchCode for each Location.

mysql> select location,count(distinct branchcode) from bank group by location;
+--------------+----------------------------+
| location     | count(distinct branchcode) |
+--------------+----------------------------+
| BANGLORE     |                          2 |
| MUMBAI       |                          1 |
| NOT PROVIDED |                          1 |
| PUNE         |                          1 |
+--------------+----------------------------+
4 rows in set (0.04 sec)